Salamandra.uk Animation Studios,"Led by another amazing female founder Christine Mackay, we love the craft of this agency, who are creators of visual content marketing solutions in animation, brand and design that perfectly engage your target audience."
San Digital,"San Digital are a technology consultancy that are brilliant at building products, with elegant user experiences and quality code."
SAND visuals,Stop motion animation experts! Their precise animation video work is impressive. They've done lots with cool FMCG brands but this can be a very engaging proposition for all sorts of sectors.
Secret Source Marketing,Studiospace loves specialist agencies. That's why we love founder Nick Carlson and his agency Secret Source who are a marketing growth agency for B2B companies that want the right sales and marketing strategy to grow their business. From website to digital marketing…
Seven Stone Collective,"As longs as its healthy, they'll create it!"
Shoreditch Design Studio,"Led by the very impressive Andrew Burton, Shoreditch Design was set up to help fintechs design new products but now they're working with some of the biggest brands around the world."
Sketch & Co,"Led by founder Jean-Baptiste Vincent, Sketch & Co are a specialist visual storytelling studio for innovation and transformational programs, helping companies bring to life their vision and big ideas through impactful stories that inspire collaboration and action."
Smartshore Ability,"Led by Founder Jelke, they really have a depth of technical capability combined with the practicality of a product shop. They're offshore model also makes them very attractive to clients."
Solace Digital,"Solace Digital offers the design savvy of large-scale agencies, the technical precision of a software company, and the efficacy of a startup. They truly are a result driven agency with over 26m users shipped to over 50+ products that they delivered."
Solution17,"Led by founder Laurence Chandler, Solution17 is a brilliant specialist web design & build digital agency. But more than that, they think of themselves as problem solvers that take away the complexity of the digital world to deliver workable solutions to their clients such as Spotify & British Airways."
SOLVNT,"With offices in America and Africa, SOLVNT brings together an incredibly diverse team of strategists and creatives to build great brands."
Sparksfly,"Led by another great husband and wife team, Sparlksfly are an agile and commercially driven Proposition and Venture Design agency."
Spin Brands,"A fantastic signing to Studiospace. Voted UK's No1 Social Media agency by Clutch, they beautifully combine social-first creative with data-driven frameworks to grow your brand on organic and paid social media platforms."
Stakk,"Led by founder Jack Tyson, Stakk has a decade of creating next-gen mobile apps. They have built a team of 30+ qualified engineers who have completed over 150 projects and written over 10m lines of code. That’s impressive!"
Stride,"Stride is a Graphic Design & Marketing Agency based in Belfast. They work with brands like Coca Cola to help bring brands to life through clear, consistent messages and outstanding creative. Belfast really is beginning to emerge as a creative hub and Stride have been at the forefront of this."
STUDIO BLUP,"Led by founder and Creative Director Dines, BLUP is a creative agency that connects brands to the new culture. Congratulations to Dines for winning the BIMA 100 Award 2023."
Studio Something,"Part of Scotland's vibrant creative scene, Studio Something are pioneering advertising & film makers with in-house creative, production and brand capabilities. We think they fall just on the right side of really challenging creative."
Studio Yes,"Led by founder Dulcie Cowling, Studio Yes is an award-winning video production company based out of London & New York, that specialises in creating films that make people smile, no matter what the message. Love their work with EasyJet ‘Kilted Yoga’. Genius!"
Studiomade,"Led by founder Phil Reid, Studiomade have built an amazing team of strategists, designers, developers, animators and writers that can deliver high-performing projects across brand, digital, marketing and content creation. But what will amaze you is the pace that they work at."
Study Hall,"Led by co-founders Alex Sheyn and Jeremy Folk, Study Hall has done some really cool work - including working on the Google Doodle and Batarang's typeface. We love their animation and illustration styles."
Submerge,With a background in journalism is a top-quality SEO agency that prides itself on quality writing.
Synthetic,"Led by Roy Murphy, Synthetic are experts in AI, chatbots, voice, generative AI, web3 and VR/AR. A global team with a local-London hub, this award-winning team of digital innovation strategists have carved out quite the reputation for helping clients ""create conversations worth millions."""
SystemSeed,"Passionate about social-good projects, SystemSeed have deep technical expertise. They have won numerous awards too, including an award for the Website of The Year as well as the Best Social Impact Site."
T-minus,"Led by Founder Ian, T-minus works at the intersection of coaching, leadership development and disruptive innovation. They help leaders release their human potential."
Taxi Studio,These guys bring great brand credibility in FMCG having worked with some of the world's best known brands. Their sweet spot is brand repositioning or rejuvenation (brand strategy) but they do plenty of activation and packaging too.
The Bang,"Part of the Northern Powerhouse, The Bang design award winning digital products. These are the guys that helped design Studiospace’s marketplace."
The Builders Arms Ltd,"Led by pioneering founders Dom, Steve and Basil, The Builders Arms is the coming together of a very experienced and progressive bunch of people who have created a new agile type of creative agency. Please check out their work for PensionBee and Remington."
The Distance App Developers,"Led by founder Anthony Main, The Distance are a multi-award winning app development company from York and London, consistently voted one of the top 5 app developers in the UK. Their specialists in building apps for iOS and Android devices. In numbers, they've built over 100 apps, with over 2 million downloads. And COUNTING!"
The Kite Factory,"Led by founder Robin Trust, The Kite Factory creates brilliant media ideas delivered by a team that goes above and beyond, with ​the means to measure them effectively. Have a look at their work with Crisis to ‘make homelessness impossible to ignore’."
The Ninety Niners,"Led by the amazing double act Si & Rich, 99ers are a new breed brand and CX consultancy that unlocks value by being relevant to real people."
The Nursery Research & Planning Ltd,"Led by very experienced founder David Alterman, The Nursery have worked all around the world and are true experts in brand, communications and experience research. And to quote David, they “love nothing more than finding the sizzle to make your brand stand out."" Love this!"
The Onlii,"Led by founder Rob Minto, The Onlii is a values driven video production and advertising agency who puts their money where their mouth is, donating 1% of their revenue to environmental non-profits."
The Park,"Led by founder Jack Lamacraft, The Park are an award winning experiential agency out of London and Sydney. Check out their amazing award-winning work with DreamWorks that takes kids on adventures like no other (even during a pandemic)."
The Space at 9/2,The ultimate designers... The Space at 9/2 has designed everything from experiences to exhibits. They apply an eye for fine art and photography delivering impactful designs that stand out.
Three Whiskey,"Led by founder Tom Jones (not the signer) who has built one of the most commercially results driven performance marketing agencies we've ever come across, their success has led them from London to Dallas."
Tinker Taylor,"Led by an amazing Female Founder, Sam Taylor, Tinker Taylor is a specialist video content agency, producing awesome content for all media channels and platforms."
Ubiquitous,Influencer marketing for some of the biggest brands in the world (with a focus on TikTok) - that's what Ubiquitous is about. They've worked with over 200 brands and agencies - delivering influencer marketing at scale.
UNIT9,"Led by Founders Piero, Tom and Yates, UNIT9 is a multidisciplinary production company working in different interactive areas of films, games, virtual reality and digital technology. Voted Production Company of the year by AdAge. Check out their work with Coke Zero, Take a Taste."
UNPITCHD,"Steph Rennucci is a new-age founder who has built a new agency model, that curates the best industry talent for the best results for every signal innovation brief they work on."
Verve,"Verve are an awesome branding and digital agency. We love their mission to 'work with the bold to create branding that wows at a global scale.’ Their work is backed up by their awards, including being recently voted European Agency of the Year 2022 - 2023."
Videomachine Limited,"Led by Phil Lyons (a very experienced agency founder), Videomachine are a boutique creative video production and photography agency. We love their focus and dedication to this craft."
Viewpoint Studios,"Led by the amazing female founder Amanda Canning, who's built an agency that consistently delivers the highest quality graphic design, photography and video product."
Warrior Agency,"Warrior was started in 2021 with one objective, to enact positive change. This might sound grand, but Lizzie believes that change doesn’t have to be big, it just has to be positive."
William Joseph,"Led by Chris Hammond, William Joseph created accessible products, services and brands that reduce inequality, leading them to deliver major projects both within the public and private sector."
xDesign,"Led by the amazing founder Euan Andrew, XDesign are one of the fastest software engineering companies in UK, with a world renowned expertise in Gen AI."
Yonder Media,Another one of our brilliant independent media agencies built for the Audience Age taking on the old guard of big media agencies. Part of the wonderful Above & Beyond group. Check out their work with Pilgrims Choice.
Akcelo,
Allied Global Marketing,
Ampel,
Apparent,
Balmer Agency,
Bread Agency,
Catch the Sun Communications,
Chello,
Common Ventures,
Edge,
Five by Five Global,
Houston,"Stuart and the Houston team have the deep experience and confidence that leaves clients feeling like they’re in the best possible hands – nothing seems to faze them, they’ve seen and done it all!"
In Marketing We Trust,
Magic,
Manifest Group,"An incredibly impressive brand communications agency that is literally taking on the world...with offices in Melbourne, London, Manchester, Stockholm, New York and Los Angeles. Built on a philosophy of building brands that can change the world, Manifest's award winning work is as charming as is it is impactful."
Noble Agency,"Ben and his team are humble, nimble and always hungry to find a smart new ways to solve the same old problems. Unfailing honest, you’ll always get a straight answer and a clear POV on the task at hand."
Palo-IT,"If you need your project delivered absolutely seamlessly, PALO IT are the safest set of hands you could hope for. All the rigour and expereince of a top end of town consultancy, with the smarts and humility of an indie. It also doesn’t hurt that they built their agency on a philosophy of “Tech as a force for good” long before it was fashionable ;)"
Rebel Angel Strategy,"Mitch's vision for founding Rebel Angel Strategy is smart, focussed and hugely relevant. His work with brand and marketing teams to help them align increasingly fragmented marketing activity for greater impact is sorely needed by many brands and businesses."
Republic of Everyone,"Republic of Everyone are a stand-out agency when it comes to sustainability and brand purpose, pioneering in these fields long before it became popular and mainstream. The ROE combine deep strategic expertise and experience with a creative edge, many other players in this space lack."
Shines Digital,Shines Digital was founded by veterans of what we now call 'performance marketing' which means their credentials are deep and impressive. Add to that a strong commercial focus and entreprenurial flair and you have a team laser focussed on driving business success.
Sitback Solutions,
SLIK,SLIK have a well deserved reputation as one of the leading digital creative and production agencies in Australia. Their relentless focus on the future coupled with their obsession with production 'craft' gives their work a
Snackable Media,"Jack and the team at Snackable know exactly what their sweet spot is - creating high impact short form content for digital platforms. Founder Jack Philips combines a strong editorial background with entrepreneurial hustle and resourcefulness,a winning combination for ambition brands that want to get noticed."
Snowmelt,
Wasamedia,HOLD - looks like they have re-named/re-branded
Wonderful,"Wonderful are very impressive, combining big business smarts and experience with a hunger and passion you only find in founder led businesses. Joining the dots between creativity, performance and technology in the pursuit of exceptional digital experiences means they can see the big picture, whilst delivering seamlessly on the detail."
JOY,"Whilst many agencies may claim to be true business partners to their clients, the founders at JOY have delivered on this promise time and time again over their 16 year history. Smart, senior, egoless thinkers and do-ers who understand how to get underneath the problem to deliver real results."
NorthSouth Advertising,"NorthSouth are the team you want in your corner when the performance of your performance marketing is mission critical. Hyper focussed search and social specialists, they go deep and are relentless in their efforts to understand what's really going so they can deliver the best possible results."
Screentide,"Screentide have an exceptional track record working over many years with leading Australian businesses and brands to deliver high quality video content creative and production. Founder Adam Marks is a calm, experienced and seasoned professional who builds strong, trust-based relationships with clients that keep them coming back year after year."
Josephmark,Josephmark are an inspiring and highly entrepreneurial business - founders Ben & Jess have grown a highly regarded global venture and brand design studio from their home base in Brisbane whilst indulging their passion for regenerative agriculture at their 50 hectare property 'Falls Farm' in the Sunshine Coast hinterland.
The Curious Co,"Eliane and her all female team at Curious Co are deeply passionate about bringing the voice of the customer (or employee) into business decision making in a way that drives better business outcomes. A tight, highly focussed team, means every project is delivered by senior, highly experienced specialist talent."
VERSA Agency,"Led by energetic and highly experienced founder, Kath Blackham, Versa is a pioneering agency focused on all digital transformation that continues to innovate and has carved out particularly unique expertise in conversational experiences and AI."
blueegg,"Bluegg, led by long-time founder, Adam Faulkner, takes a disciplined and science-based approach to understanding user needs and designing impactful user experiences."
Coredo,"Founded by ex-Olympian and Accenture technology consultant, Joona Puhakka, Coredo specialises in creating quality software solutions for growing companies through its highly capable development teams based in India."
Fonto,"Fonto has developed a unique platform that delivers rapid insights based on what consumers actually did or spent on, not what they said they did long after the event. Fonto is often faster, more accurate and cost effective than traditional research methods."
Harrison,"The global Harrison team has worked with some of the most iconic brands in food, beverage and hospitality to create signature physical experiences that stand out in crowded markets and deliver commercially for their clients."
Honest Fox,
Mighty Nice,"Might Nice creates stunning, creative and entertaining animated films for clients globally, out of their base in Australia. They are multi-award winning and always put the creative first."
MindArc,"MindArc are one of the best eCommerce agencies in the Aussie market and a leader in Shopify Plus. Their full service offering across UX design, build and digital marketing has helped many great brands make the most of their eCommerce channel."
Muteo,"If you're working out how to design a digital experience that builds trust with your customers and delivers on high ethical standards, then Muteo are well worth speaking to. They have done some brilliant work in financial services and other industries to design intuitive experiences around new innovative technologies."
MYMAVINS,"Led by two senior research experts, Jason and Tai, MyMavins delivers rigorous qual and quant research projects. They are really strong in financial services research, bringing a unique perspective from Jason's previous career in financial planning and advice."
Nibble Digital,"The Nibble team delivers high quality digital solutions for growing and established brands, such as Society One, Challenger and Optus that want to work with a nimble, practical and great value partner. Their glowing client testimonials speak for themselves and speak to the high impact they deliver for clients."
Path Ventures,"Path founder, Jaimes Nel, brings two decades of strategic design experience and deep, rigorous thinking to all his projects - he's quickly become a go-to strategist and problem solver for some of Studiospace's biggest clients looking to develop new proositions and services."
Phase One Insights,Phase One combines the best of traditional market research with human centred-design approaches to help entrepreneurial clients in big brands uncover new opportunities and paths to growth with their customers.
Sketch & co,"Sketch & Co, founded by the highly talented JB Vincent, delivers engaging visual storytelling to help clients communicate and engage their people in transformation. JB's unique background as a previous senior digital transformation consultant for the likes of Deloitte and Cap Gemini, combined with his skills as a talented artist make him unique as a translator and storyteller for major organisation change."
TheDesignThinkers,"TheDesignThinkers, led by Nicola Mansfield brings sharp customer-focused thinking to transform brands and experiences. Nicola brings decades of experience in brand, propositions and experience from big agencies, consultancy and in-house roles to deliver pragmatic but stand-out solutions for her clients."
5 Ways to Innovate,"Know you need to innovate but not sure what's right for your company, where to start or where to focus? Speak to 5 Ways. The 5 Ways team, led by Amer Iqbal, has developed an engaging, efficient methodology to get clients started and set up for success on the innovation journey - all backed by their own career experiences working for some of the world's biggest brands and proprietary research with leading innovative companies."
Anchora,"Led by seasoned founder, Luke Evans, Anchora delivers complex martech and customer experience management solutions for its clients, helping them to realise the promise of digital experience platforms - and the team has deep expertise with the Adobe stack."
Arktic Fox,"Arktic Fox brings their deep experience as practictoners from leading brands to offer clients a unique combination of advisory and learning solutions, to build the capability of client teams as they digitally transform and pursue new growth through digital."
DO. Agency,
Ellipsis,"Ellipsis has developed a reputation as market leaders when it comes to helping major brands crack the code on what drives customer loyalty, and how to develop and realise successful customer loyalty strategies - regardless of industry sector."
IE,We've been really impressed by the depth and rigour the IE team brings to every conversation and project. IE should be on your list if you're looking to develop a new digital product that your customers love and has a big commercial impact on your business.
Objective Experience,"Objective Experience, founded by James Breeze are one of the original experts in user research and UX design in Australia and APAC, having pioneered the use of eye tracking technology in the region, and over many years working with top local and global client brands."
STCK Strategic Design,"Led by Stephen Graham, STCK is a small expert team focused on service design that has had an impressive impact on the clients they have worked with."
Tobias,"Human Centred Design is everywhere these days - but the Tobias team really are some of the best when it comes to the discipline and applying it to clients' strategic, growth and innovation challenges. An incredibly talented team of strategists, researchers, designers and technologists, that are committed to doing good in the world, Tobias has a loyal client following across public sector, corporate and start-up clients alike."
